0,"The flag held by hostages against the window of a Sydney cafe in television pictures beamed around the world is not directly associated with the Islamic State group, but has been co-opted by other jihadist organizations, Australian media reported Monday.  The white Arabic writing on the black flag is the Shahada, or Islamic declaration of faith. Translated, the statement means ""There is no God but Allah and Muhammad is His messenger."" It is considered the first of Islam's five pillars of faith, and is similar to the Lord's Prayer in Christianity. It is pervasive throughout Islamic culture, including the green flag of Saudi Arabia. Jihadis have expropriated the Shahada in their own black flag.  ""It is not the Islamic State flag per se,"" Ben MacQueen, a senior politics lecturer at Monash University in Melbourne, told the Sydney Morning Herald. ""It has been used in recent times, for example, by Chechen groups.""  Australian authorities have repeatedly warned about the threat posed by Islamic State, better known as ISIS. Earlier this week, the government estimated that approximately 70 Australians are currently fighting with the terror group in Iraq and Syria, while another 20 are believed to have been killed in action and 20 others are believed to have returned home.  In September, police made over a dozen separate raids in the suburbs of three cities, including Sydney, in an effort to break up a plot to behead a randomly selected person on a city street and record it. Days later, Australian intelligence agencies said they had uncovered an ISIS plot to attack the country's parliament.  Terrorism experts said Monday that the flag used by the unidentified hostage-taker neither confirms nor rules out an association with ISIS.  ""Getting hold of an [ISIS] flag would be quite difficult,"" Greg Barton of Monash University in Melbourne told the Sydney Morning Herald. ""and people will make do with what they have got.""  MacQueen concurred, suggesting that the hostages were ""maybe young guys, maybe not savvy, they've got their hands on a bit of paraphernalia to suggest they have aligned themselves with the IS. If this was centrally organized from Syria or Iraq they would not be using that flag.""  The Associated Press contributed to this report.  Click for more from the Sydney Morning Herald."
0,"Live television footage in Sydney estimates that there are 13 hostages in the Lindt Chocolate Café in Sydney, Australia. Their hands are pressed against the windows, where a black and white flag with Arabic letters is visible.  While initially reported as an ISIS flag, ITV has reported that the text translates as ""There is no God but Allah and Mohammed is the messenger of God."" And that it is not specifically linked with that particular terrorist group.  Australia is backing the United States in its action against ISIS in Syria and Iraq. Armed police have closed off the surrounding area, which includes the Reserve Bank of Australia. Trains and buses have halted after a train operator said there was a bomb threat called in at Martin Place. Airspace over the area has also been closed.  According to Business Insider, the man, armed with a shotgun, have made demands to speak to ""a senior Australian public figure"" and warn that bombs have been placed at various locations in the city. That report, however, has not been verified.  Local officials are concerned that the armed man might be part of a home-grown Muslim faction that has returned from the Middle East.  UPDATE: Prime Minister Tony Abbott addressed reporters, and said security agencies had not detected any additional plots but that there are citizens in Australia with the ""intent and capability"" to carry out a terror attack. Abbott said there will be ""more security"" at airports, ports, military bases, public buildings and large public events.  ""Normal life in Australia can and must go on,"" Abbott said.    UPDATE:  Confirmation from police that three hostages have been released. #SydneySiege — Maria Lewis (@moviemazz) December 15, 2014  #BREAKING: Two more hostages have just escaped from #sydneysiege — Sky News Australia (@SkyNewsAust) December 15, 2014    This is the moment the last woman escaped https://t.co/QyaNJ4cRbf — Let it Di Stefasnow (@MarkDiStef) December 15, 2014    PREVIOUSLY:  ​  BREAKING @SkyBusiness: @ljayes : #sydneysiege flag: ""There is no god but Allah and Mohammed is the messenger of god"". pic.twitter.com/LbzVQPYWca — Carson Scott (@carsonscottLIVE) December 14, 2014  BREAKING: First photo of middle-aged hostage-taker, who is wearing a black bandana while conducting the #SydneySiege. pic.twitter.com/Rv2cvDG2vT — Jack Moore (@JFXM) December 15, 2014  NSW Premier Mike Baird says his thoughts and prayers are with the people in the #sydneysiege. http://t.co/7NdqPYhwcY pic.twitter.com/I71KEcYFIy — ABC News (@abcnews) December 15, 2014  PM Abbott on #sydneysiege: ""I would urge all Australians today to go about their business as usual "" pic.twitter.com/21WRvCOjzd — TEN Eyewitness News (@channeltennews) December 15, 2014 UPDATE:  Local media reports hostages seen running out of cafe #sydneysiege #BREAKING we'll have latest @AJENews now — Maryam Nemazee (@MaryamNemazee) December 15, 2014    [via ITV]"
0,"During the hunt – which the organisers later admitted was badly carried out – it was alleged that Cecil was lured at night about half a mile out of the national park using bait, and then shot with a bow and arrow. The next day he was found wounded by the hunters and killed, before being beheaded and skinned."
0,"SYDNEY (Reuters) - Heavily armed Australian police stormed a Sydney cafe early on Tuesday morning and freed a number of hostages being held there at gunpoint, in a dramatic end to a 16-hour siege in which three people including the attacker were killed.  Police have not publicly identified the gunman but a police source named him as Man Haron Monis, an Iranian refugee and self-styled sheikh known for sending hate mail to the families of Australian troops killed in Afghanistan. He was charged last year with being an accessory to the murder of his ex-wife.  Prime Minister Tony Abbott said the gunman was well known to authorities and had a history of extremism and mental instability.  During the siege at the Lindt cafe in Sydney’s central business district, hostages had been forced to display an Islamic flag, igniting fears of a jihadist attack in the heart of the country’s biggest city.  Around 2 a.m. local time (10.00 a.m. ET on Monday), at least six people believed to have been held captive managed to flee after gunshots were heard coming from the cafe.  Police then moved in, with heavy gunfire and blasts from stun grenades echoing from the building.  “They made the call because they believed at that time if they didn’t enter there would have been many more lives lost,” said Andrew Scipione, police commissioner for the state of New South Wales.  An investigation would determine whether hostages were killed by the gunman or died in cross-fire, Scipione told reporters just before dawn.  Police said a 50-year-old man, believed to be the attacker, was killed. Television pictures showed he appeared to have been armed with a sawn-off shotgun.  A man aged 34 and a 38-year-old woman were also killed, police said. The man was the cafe manager and the woman was a mother and barrister, local media reported. Four were wounded, including a policeman hit in the face with shotgun pellets.  Medics tried to resuscitate at least one person after the raid and took away several wounded people on gurneys, said a Reuters witness at the scene. Bomb squad members moved in to search for explosives, but none were found.  So far 17 hostages have been accounted for, including at least five others who were released or escaped on Monday.  “To the people of Sydney, this was an isolated incident ... Do not let this sort of incident bring about any loss of confidence of working or visiting our city,” said Scipione.  On Tuesday morning, the area near the cafe remained cordoned off, with bystanders and passing office workers leaving flowers under police tape. Flags flew at half mast across the city.  Leaders from around the world had expressed their concern over the siege, including Stephen Harper, the prime minister of Canada, which suffered an attack on its parliament by a suspected jihadist sympathizer in October.  NO LINKS TO TERROR GROUPS  Monis was found guilty in 2012 of sending offensive and threatening letters to families of eight Australian soldiers killed in Afghanistan, as a protest against Australia’s involvement in the conflict, according to local media reports. Monis was also facing more than 40 charges of sexual assault.  Slideshow ( 32 images )  “He had a long history of violent crime, infatuation with extremism and mental instability,” Abbott told reporters in Canberra. The prime minister did not identify the gunman.  A U.S. security official said the U.S. government was being advised by Australia that there was no sign at this stage that the gunman was connected to known terrorist organizations.  Although the hostage taker was known to the authorities, security experts said preventing attacks by people acting alone could be difficult.  “We are entering a new phase of terrorism that is far more dangerous and more difficult to defeat than al Qaeda ever was,” said Cornell University law professor Jens David Ohlin, speaking in New York.  Slideshow ( 32 images )  ON ALERT  Australia, a staunch ally of the United States and its escalating action against Islamic State in Syria and Iraq, has been on high alert for attacks by home-grown militants returning from fighting in the Middle East or their supporters.  News footage showed hostages in the cafe holding up a black and white flag displaying the Shahada, a testament to the faith of Muslims. The flag has been popular among Sunni Islamist militant groups such as Islamic State and al Qaeda.  The incident forced the evacuation of nearby buildings and sent shockwaves around a country where many people were turning their attention to the Christmas holiday after earlier security scares.  In September, anti-terrorism police said they had thwarted an imminent threat to behead a random member of the public and days later, a teenager in the city of Melbourne was shot dead after attacking two anti-terrorism officers with a knife.  The siege cafe is in Martin Place, a pedestrian strip popular with workers on a lunch break, which was revealed as a potential location for the thwarted beheading.  Muslim leaders urged calm. The Australian National Imams Council condemned “this criminal act unequivocally” in a joint statement with the Grand Mufti of Australia.  The security operation was the biggest in Sydney since a bombing at the Hilton Hotel killed two people in 1978."
0,"NEWS: President Obama is reportedly pushing to extend gun background checks to Social Security disability recipients.  Claim: President Obama is planning to ban all Social Security recipients from owning guns.  MIXTURE  WHAT’S TRUE: The Obama administration is seeking to use Social Security Administration data about disability recipients to enforce existing gun purchase restrictions.  WHAT’S FALSE: President Obama is planning to bar all Social Security recipients from owning guns.  Origins: In a case reminiscent of a January 2009 piece of satire, July 2015 news reports indicated that the Obama administration was seeking tighter controls over firearm purchases by pushing to bar Social Security beneficiaries from owning guns if they lack the mental capacity to manage their own affairs.  The move is being tagged as part of an effort by the Obama administration to strengthen gun control after the 2012 Sandy Hook Elementary School shooting, a plan that includes trying to plug holes in the firearms purchase background check system. The intent of the Social Security check is to bring the Social Security Administration in line with other laws that regulate who gets reported to the National Instant Criminal Background Check System (NICS), a database used to prevent gun sales to excluded classes such as felons, drug addicts, dishonorably discharged service members, fugitives, and illegal immigrants. (That is, the Obama administration isn’t seeking to create new classes of persons excluded from gun ownership — those exclusions already exist, and the administration is only positing the use of Social Security Administration reporting as a method of enforcing them.)  Such a move could potentially affect millions of Social Security disability recipients whose payments are handled by others due to “marked subnormal intelligence, or mental illness, incompetency, condition, or disease.” Those persons would likely be identified through the reporting of anyone who has been declared incompetent to manage their own pension or disability payments and has been assigned a fiduciary as a result.  Opponents of the plan maintain that the implementation of such a background check system could unfairly exclude large numbers of people who pose no real danger to others from gun ownership:  Critics — including gun rights activists, mental health experts and advocates for the disabled — say that expanding the list of prohibited gun owners based on financial competence is wrongheaded. Though such a ban would keep at least some people who pose a danger to themselves or others from owning guns, the strategy undoubtedly would also include numerous people who may just have a bad memory or difficulty balancing a checkbook, the critics argue. “Someone can be incapable of managing their funds but not be dangerous, violent or unsafe,” said Dr. Marc Rosen, a Yale psychiatrist who has studied how veterans with mental health problems manage their money. “They are very different determinations.” Rosen said some [people] may avoid seeking help for mental health problems out of fear that they would be required to give up their guns. Ari Ne’eman, a member of the National Council on Disability, said the independent federal agency would oppose any policy that used assignment of a representative payee as a basis to take any fundamental right from people with disabilities. “The rep payee is an extraordinarily broad brush,” he said.  The federal background check system was created in 1993 through the Brady Handgun Violence Prevention Act (named after White House Press Secretary James Brady, who was severely wounded during the 1981 assassination attempt on President Reagan) and requires gun stores to check the names of prospective buyers through the system before every sale. The database holds over 13 million records, entered at the local, state, and federal level, but it has not always served its intended purpose due to inconsistencies in reporting and use — for example, when Seung-Hui Cho killed 32 people after the 2007 Virginia Tech shooting, it was later found that he had been declared mentally ill by a court and ordered to undergo treatment, but the law in effect at the time did not require that he be added to the database.  A similar system already in use by the VA for beneficiaries has drawn similar criticisms:  The VA reports names under a category in gun control regulations known as “adjudicated as a mental defective,” terminology that derives from decades-old laws. Its only criterion is whether somebody has been appointed a fiduciary. More than half of the names on the VA list are of people 80 or older, often suffering from dementia, a reasonable criterion for prohibiting gun ownership. But the category also includes anybody found by a “court, board, commission or other lawful authority” to be lacking “the mental capacity to contract or manage his own affairs” for a wide variety of reasons. The agency’s efforts have been criticized by a variety of groups. Social Security would generally report names under the same “mental defective” category. The agency is still figuring out how that definition should be applied. About 2.7 million people are now receiving disability payments from Social Security for mental health problems, a potentially higher risk category for gun ownership. An addition 1.5 million have their finances handled by others for a variety of reasons. Since 2008, VA beneficiaries have been able to get off the list by filing an appeal and demonstrating that they pose no danger to themselves or others. But as of April [2015], just nine of 298 appeals have been granted, according to data provided by the VA. Thirteen others were pending, and 44 were withdrawn after the VA overturned its determination of financial incompetence."
0,Facebook suspends former U.S. President Trump’s account until 2023 Technology · 6:51 PM UTC  Facebook Inc (FB.O) on Friday suspended former U.S. President Donald Trump from its platform until at least January 2023 and announced changes to how it will treat rule-breaking world leaders in the future.
0,"A Swiss museum on Monday accepted the bequest of an art collection hoarded during the Nazi era and left to it by German recluse art collector Cornelius Gurlitt.  The president of the board of trustees of the Bern Museum of Fine Arts, Christoph Schäublin, made the announcement at a press conference in the German capital, Berlin.  He gave assurances that all works in the collection that had been looted from Jewish owners during the Nazi era would be returned to their rightful owners, adding that works which were suspected of having been stolen would remain in Germany and be investigated by a special task force established to determine their provenance.  The costs for restoring the works to their rightful owners would be taken over by Germany, he said.  A summary (PDF) of the agreement between the Bern Museum of Fine Arts, the German state of Bavaria and the German Federal Government can be seen here.  Spectacular find  Authorities in Bavaria seized the spectacular trove of more than 1,000 artworks - including priceless paintings and sketches by Picasso, Monet, Chagall, Liebermann (above) and other masters - from the flat of German collector Cornelius Gurlitt as part of a tax probe in 2012.  More than 300 other works were later discovered in a home Gurlitt owned in Salzburg.  Gurlitt, who bequeathed the collection to the museum when he died in May, was the son of one of Adolf Hitler's art dealers, who helped plunder artworks from museums and Jewish collectors.  Angry at his treatment by German authorities, who confiscated all of the Munich works, Gurlitt left the collection to a Swiss museum rather than a German one.  Legal challenges likely  Before his death, Gurlitt reached a deal with the German government to check whether any of the works should be restored to heirs of the former Jewish owners. Authorities say the deal would be binding on anyone who accepts the inheritance.  A report by the German news weeky Der Spiegel said that nearly 500 of the works were suspected of being looted.  One of Gurlitt's cousins, 86-year-old Uta Werner, has also laid claim to the trove after a psychiatric assessment called into question Gurlitt's testamentary capacity when writing the will.  That claim could lead to years of legal limbo, with Jewish descendants of the original owners fighting their claims in German courts.  The Munich court dealing with the claim said it would have to be settled before the collection finds its final home anywhere. A court spokeswoman said she did not know how long this would take.  Jewish groups and the US and Israeli governments put pressure on Germany to establish a task force to investigate the provenance of the works.  tj/jr (dpa, AFP)"
0,"  Alexander Panetta, The Canadian Press      WASHINGTON -- The chaos in Canada's capital attracted the attention of people around the world Wednesday, including U.S. President Barack Obama who received a briefing on the developments from the Oval Office.  The U.S. government increased security in different locations, including at its embassy in Ottawa and reportedly also at its own tomb of the unknown soldier at Arlington National Cemetery near downtown Washington.  Obama spoke by phone with Prime Minister Stephen Harper hours after a masked gunman shot an honour guard at the National War Memorial.  A spokesman for the U.S. president began the White House daily briefing with a word of condolence, as news of the incident spread around the world.  ""Before I go to your questions, there is some sad news out of Canada today I just wanted to talk about,"" said Obama's press secretary Josh Earnest.  ""The thoughts and prayers of everybody here at the White House go out to the families of those who were affected by today's shooting in Canada, as well as to the family of the soldier who was killed earlier this week.""  He said officials throughout the U.S. government had been in close touch with their counterparts in Canada -- which he described as a valued friend and partner.  British Prime Minister David Cameron took to Twitter to express his indignation at the events unfolding in Canada: ""I'm appalled by today's attack in Ottawa. I offer my full support to (at)pmharper and the Canadian people as they deal with this incident.""  Meanwhile, the Canada-U.S. North American Aerospace Defence Command said it had taken steps so that it could respond should there be any incidents involving aviation.  Down the street from the White House, on Pennsylvania Avenue, the Canadian embassy denied a U.S. media report that it had been placed on lockdown. A spokeswoman for the embassy said that, following news of the shooting, staff there simply locked the embassy's front door.  The shooting quickly became a top news story in numerous countries.  All the main American news networks offered live coverage throughout the day. It was also the lead item on the best-known newspapers in a number of countries including the U.S., the UK, Mexico, France and Italy.  The top headline on France's Le Monde newspaper website was, ""Ottawa Boucle"" (Ottawa On Lockdown). Italy's La Repubblica website ran numerous headlines underneath one that declared, ""Canada Sotto Attacco"" (Canada Under Attack).  Even in Turkey -- which borders an active war zone where an international coalition is fighting Islamist rebels -- the Canadian events became a top news item.  A number of Canadian politicians who witnessed the scenes on Parliament Hill appeared on American news shows to describe what they'd seen. The NDP's Charlie Angus described hearing the gunshots from inside the Opposition members' chamber during the weekly caucus meeting.  Angus told Fox News that Canadians weren't going to be intimidated by this type of act.  ""We're not gonna let punks, or crazies, or terrorists, take us down. Not gonna happen,"" the NDP MP told the cable-news outlet.  ""We don't give in to it.""  One U.S. law-enforcement analyst said this incident will prompt the same kind of scrutiny that occurred when a knife-wielding man recently jumped the fence to enter the White House.  That incident prompted a series of follow-up stories about other security lapses, which led to the resignation of the head of the Secret Service.  A recurring theme of some of the American news coverage was that question of security: How did a gunman manage to walk into Canada's Parliament?"
1,"Woman Arrested For Masturbating With Jimmy Dean Sausage In Walmart Bathroom  Woman Arrested For Masturbating With Jimmy Dean Sausage In Walmart Bathroom – News 8 Louisiana – Police are calling this a crime of the unthinkable, something that most people would never imagine doing. On Monday, police were called to a Louisiana Walmart under the suspicion that a customer was shoplifting food. According to the complaint, a Walmart worker radioed security about a suspicious woman in the meat aisle. Security cameras filmed 33-year-old Shaniqua Johnson shoving sausages under her shirt. CCTV footage then shows the woman walking to the bathroom, where she remained for at least 30 minutes.  The male security guard says he knocked on the bathroom door several times but the woman did not respond. He then announced he was entering. What he found behind the door of the unlocked stall is something he said will “haunt his dreams forever.” The security guard reports when he entered the stall, Johnson was inappropriately pleasing herself with a Jimmy Dean package of sausage. He said that when he entered “She didn’t even stop. She just stared at me and kept going.”  Woman Arrested For Masturbating With Jimmy Dean Sausage In Walmart Bathroom  Shocked, and also frightened for his safety due to the fact that Johnson is a “big girl,” the 140 pound security guard said he ran out until police arrived. When they did, female officers entered the restroom with Johnson still “putting in work with the sausage.” All in all, it took 7 police officers to restrain Johnson and pry the victimized sausage out of the woman’s hands. She was arrested and taken into custody where she was charged with shoplifting, indecent exposure, and resisting arrest. Walmart management said in no way do they tolerate this type of behavior. They have a strict policy against shoplifters and a sign on the bathroom door that clearly reads, “No merchandise allowed beyond this point.”"
